{"SchemaVersion":"config-set-v2","ConfigSetId":"ER06B-R1-PRODUCTION-E2E-TEST-FIXTURE-ONLY-V1","ProfileKind":"TestFixtureOnly","ScientificUse":"TEST_FIXTURE_ONLY_PRODUCTION_PATH_QA_NOT_SCIENTIFIC_EVIDENCE","AuthorizedStage":"T4","CanonicalizationVersion":"canonical-json-v1-utf8-no-bom","ApprovalStatus":"Approved","OwnerId":"ER06B_R1_FIXTURE_QA","CreatedById":"ER06B_R1_FIXTURE_GENERATOR","UnresolvedPlaceholders":[],"Files":[{"RelativePath":"action_config_v2.json","Sha256":"F9506EC5C77F5A96D83D206D53E6F2108C975BCF6541D4C992AF3C023E07D059","Role":"actions"},{"RelativePath":"artifacts/action_admissibility.artifact","Sha256":"428A5411CC9F0826B5FF11C44FFF7B915037C67B801FA0B2408088AE42EDCCBC","Role":"protocol-artifact"},{"RelativePath":"artifacts/b1_periodic.design-artifact","Sha256":"53792268A269254684FCDC035863DD6CC33792549E9D86CA8B69ABD7EC541937","Role":"baseline-design-artifact"},{"RelativePath":"artifacts/b2_observed_proxy.design-artifact","Sha256":"6011DA0976A31112CAD8B92BCE095104DE1DCE83F7EC0523C14C06E2E1EA95EC","Role":"baseline-design-artifact"},{"RelativePath":"artifacts/b3_posterior_mean.design-artifact","Sha256":"16C8FFE683A388D568A8E9A4B379088E6CA1C203B85EDFB275CA3978A9875359","Role":"baseline-design-artifact"},{"RelativePath":"artifacts/b4_posterior_quantile.design-artifact","Sha256":"6DEFDC3B6C04BE71A384FFAA255E6BC586FF4EB997322933D8147E50E00FF5A3","Role":"baseline-design-artifact"},{"RelativePath":"artifacts/b5_first_passage_quantile.design-artifact","Sha256":"FDB2B7B2E77A66059E42BCBC89E1551BE081EA07B20452E08740458602D2700F","Role":"baseline-design-artifact"},{"RelativePath":"artifacts/exposure_transition.artifact","Sha256":"B278D1DD8AEE72D04333108A994753C0CF8FB91D0CDFE1F5C965931B1EFD3CBD","Role":"model-artifact"},{"RelativePath":"artifacts/inspection_observation.artifact","Sha256":"22AEC0608CF9DC0426420A02733AB004671EE62C2EBA95BFC99CBAC003E2D4AD","Role":"model-artifact"},{"RelativePath":"artifacts/limit_state.artifact","Sha256":"4DC298B2B1D5029837D20FEB1C5D044E233392C19DDDA72F896F7D51394CDFA5","Role":"model-artifact"},{"RelativePath":"artifacts/monitor_observation.artifact","Sha256":"D9F9BDF75188629F0E8BCE20A385814906309C47362803E90B9F325A9CA356D3","Role":"model-artifact"},{"RelativePath":"artifacts/reset_distribution.artifact","Sha256":"2535565AF07A4FB99284155121A5D911DC111930D43EA5FDEC5641B34E1C3AB4","Role":"model-artifact"},{"RelativePath":"artifacts/routine_observation.artifact","Sha256":"931EB6E190E10C2B9F6B839E1F361CAC087E67BB06A425CBEF2DEFEF018B58AE","Role":"model-artifact"},{"RelativePath":"artifacts/weighted_belief.artifact","Sha256":"429385BC0423583507B095C707315EFDF15EA7595959F9D54FB1754E9F53C232","Role":"model-artifact"},{"RelativePath":"baseline_config_v2.json","Sha256":"5538D151F48BB9FDD499116F792678B3C83DE92EAE538C75F75AB065141C28D6","Role":"baselines"},{"RelativePath":"compatibility_manifest_v2.json","Sha256":"5499D9C551D7B4B90E644B1EC551D9FD7C299B8A4D733411A072EEF50D4986B1","Role":"compatibility"},{"RelativePath":"consequence_config_v2.json","Sha256":"EF5CFD6968991F76780B965DCED4543E3902F07B4C832141CDE27DF7A62A5B7F","Role":"consequences"},{"RelativePath":"experiment_set_manifest.json","Sha256":"DBAD34544B2401A4921A35375153A0029C1DBE026F66A6A85B144E64FEAADBD7","Role":"experiment-set"},{"RelativePath":"model_config_v2.json","Sha256":"9E16672745EC79445E77F31B013F4C34E049C20854BD4F19A22DAF9962B3C813","Role":"model"},{"RelativePath":"numerical_config_v2.json","Sha256":"1A449C435FCB5720FCD9A657652B743E853560BDB2F968AE62E7C45924C1285E","Role":"numerical"},{"RelativePath":"output_policy_v2.json","Sha256":"ED3FB61770BA0432807162AE12D58FC0C172396EDB70C7374272873FD5E0192F","Role":"output-policy"},{"RelativePath":"owner_approval_manifest.json","Sha256":"6ADC61EC8727BB92D4C36F2BDB85FC719E3ECAA791D08EA4654EA94A41129A8C","Role":"owner-approval"},{"RelativePath":"reliability_config_v2.json","Sha256":"22FBC7A2D3C26E662CEE91429BE37F603836309E248D2D7BCA283D39E6E7E6C0","Role":"reliability"},{"RelativePath":"resource_ceiling_config.json","Sha256":"FFD2919F740BCF61A55DF81559F88803B5A608ED38899429480AFE8FD23614C2","Role":"resources"},{"RelativePath":"retirement_denylist.json","Sha256":"B9FA3B929961E5FA80F2FAF75A66880D8A8D622E1DEED1DB88D299600C3DDB16","Role":"retirement"},{"RelativePath":"split_manifest_v2.json","Sha256":"A29317B27CFFC3C82375E4D05C7DDE10D36BB34672550EAA6380EA62BDFC43C0","Role":"split"},{"RelativePath":"T5-001_effective_config.json","Sha256":"50FE67E4534D67E4B40F104E64C4B290DE6C0D4ED308751BA9A4C5569D2FC988","Role":"effective-experiment"},{"RelativePath":"T5-002_effective_config.json","Sha256":"15EE02FFD2A214E0E6BF4B5077E65E6A7AB7B44DEAD405BFCE35431B00583FF6","Role":"effective-experiment"}]}