{"ApprovalStatus":"Approved","AuthorizedStage":"T6","CanonicalizationVersion":"canonical-json-v1-utf8-no-bom","ConfigSetId":"ER07B-R1-1152-T6-EIGHT-ROWS-RUNTIME-CONFIG-V1","CreatedById":"ER07B_R1_DETERMINISTIC_SCHEMA_BRIDGE","Files":[{"RelativePath":"action_config_v2.json","Role":"actions","Sha256":"CC51C52B015D8F3AB000840B1962DB839D3E444BF3034B8CE62071DA716DDED1"},{"RelativePath":"artifacts/action_admissibility.artifact","Role":"protocol-artifact","Sha256":"428A5411CC9F0826B5FF11C44FFF7B915037C67B801FA0B2408088AE42EDCCBC"},{"RelativePath":"artifacts/b1_periodic.design-artifact","Role":"baseline-design-artifact","Sha256":"53792268A269254684FCDC035863DD6CC33792549E9D86CA8B69ABD7EC541937"},{"RelativePath":"artifacts/b2_observed_proxy.design-artifact","Role":"baseline-design-artifact","Sha256":"6011DA0976A31112CAD8B92BCE095104DE1DCE83F7EC0523C14C06E2E1EA95EC"},{"RelativePath":"artifacts/b3_posterior_mean.design-artifact","Role":"baseline-design-artifact","Sha256":"16C8FFE683A388D568A8E9A4B379088E6CA1C203B85EDFB275CA3978A9875359"},{"RelativePath":"artifacts/b4_posterior_quantile.design-artifact","Role":"baseline-design-artifact","Sha256":"6DEFDC3B6C04BE71A384FFAA255E6BC586FF4EB997322933D8147E50E00FF5A3"},{"RelativePath":"artifacts/b5_first_passage_quantile.design-artifact","Role":"baseline-design-artifact","Sha256":"FDB2B7B2E77A66059E42BCBC89E1551BE081EA07B20452E08740458602D2700F"},{"RelativePath":"artifacts/exposure_transition.artifact","Role":"model-artifact","Sha256":"B278D1DD8AEE72D04333108A994753C0CF8FB91D0CDFE1F5C965931B1EFD3CBD"},{"RelativePath":"artifacts/inspection_observation.artifact","Role":"model-artifact","Sha256":"22AEC0608CF9DC0426420A02733AB004671EE62C2EBA95BFC99CBAC003E2D4AD"},{"RelativePath":"artifacts/limit_state.artifact","Role":"model-artifact","Sha256":"4DC298B2B1D5029837D20FEB1C5D044E233392C19DDDA72F896F7D51394CDFA5"},{"RelativePath":"artifacts/monitor_observation.artifact","Role":"model-artifact","Sha256":"D9F9BDF75188629F0E8BCE20A385814906309C47362803E90B9F325A9CA356D3"},{"RelativePath":"artifacts/reset_distribution.artifact","Role":"model-artifact","Sha256":"2535565AF07A4FB99284155121A5D911DC111930D43EA5FDEC5641B34E1C3AB4"},{"RelativePath":"artifacts/routine_observation.artifact","Role":"model-artifact","Sha256":"931EB6E190E10C2B9F6B839E1F361CAC087E67BB06A425CBEF2DEFEF018B58AE"},{"RelativePath":"artifacts/weighted_belief.artifact","Role":"model-artifact","Sha256":"429385BC0423583507B095C707315EFDF15EA7595959F9D54FB1754E9F53C232"},{"RelativePath":"baseline_config_v2.json","Role":"baselines","Sha256":"001F23F2F3745B6DE26CFD82606D2BE62E30E5CE5414F714BC5FB251ECD5D3BA"},{"RelativePath":"bridge/t6-bridge-manifest.json","Role":"t6-bridge-manifest","Sha256":"478088F41E4DEBE1D5B20A337EFBA1DE0A1D2494F2E08682AE2C52FD2C568D52"},{"RelativePath":"bridge/t6-schema-binding-register.csv","Role":"t6-binding-register","Sha256":"7DFB929BBDC43C33FE975897277BB8E9D19A23C662EB3D5252CBCDA1533AC433"},{"RelativePath":"compatibility_manifest_v2.json","Role":"compatibility","Sha256":"6673C4B69EAF107D06657C3DDA595E58EC38B96176B20AE5100EDA379E343A0B"},{"RelativePath":"consequence_config_v2.json","Role":"consequences","Sha256":"63CA1A4E300B7805122B130A5B52F77CC5A8B5E52BD28957C6424FBE98E64C0C"},{"RelativePath":"design-authority/ablation_and_robustness.json","Role":"er07a-design-authority","Sha256":"23D6B55ED5FC7D357D8EEAE76343BB8A2DC311995F9C472D7C466987857D2B51"},{"RelativePath":"design-authority/authority_binding.json","Role":"er07a-design-authority","Sha256":"C5A678A4EE69455E8386D12BA04F29D0A598495DCD912EDD72720537600B4042"},{"RelativePath":"design-authority/authorization_allowlist.json","Role":"er07a-design-authority","Sha256":"9EE9DD99CA617A1DA574D2829714AC3BE8C780F685866F5CFF1A8379C5ECB8A1"},{"RelativePath":"design-authority/claims.json","Role":"er07a-design-authority","Sha256":"503A3E82AA6A7272CB5BD0B39A95C1E0C5597C9E27E348FD03B312A024D9EE6B"},{"RelativePath":"design-authority/config_set_manifest.json","Role":"er07a-design-authority","Sha256":"B4042731769EFB57D8F6F77FD9E436988043C36014A8A624087F257C0F24A213"},{"RelativePath":"design-authority/numerical_protocol_v2.json","Role":"t6-numerical-protocol","Sha256":"4B2165B7D4C142EA76C93004C162562023FDA3817AA593979DABEEB6FDFAA64A"},{"RelativePath":"design-authority/output_policy.json","Role":"er07a-design-authority","Sha256":"F67892F73424123B7215CD761EA81011947BC820EB14003A65780D73E8D48DDA"},{"RelativePath":"design-authority/policies_actions_outcomes.json","Role":"er07a-design-authority","Sha256":"43E749B235DF2E66B2D64429EB169DF673D199EEA600CF55CBA2C23F78A9862C"},{"RelativePath":"design-authority/resource_ceiling.json","Role":"er07a-design-authority","Sha256":"291227C1EB14D265EF9CED1A62E146937DEFE639BB7921887940D13AF52A5BA1"},{"RelativePath":"design-authority/rng_manifest.json","Role":"er07a-design-authority","Sha256":"BFBB8E52AB789555A5D11CCCD1C21726B9197976DD17EDCFF041BA5E8D054BB6"},{"RelativePath":"design-authority/sample_size_and_scenarios.json","Role":"er07a-design-authority","Sha256":"AE8210B832055CF1F872564328472D54FB57C8CA44C58DA43AA78645DEDC808F"},{"RelativePath":"design-authority/source_governance.json","Role":"er07a-design-authority","Sha256":"7A6A503ABE18A8D14D2197D54ACBD9B677E34B26FB6639B968EB626A87C6D796"},{"RelativePath":"design-authority/statistical_protocol.json","Role":"t6-statistical-protocol","Sha256":"79951068A6338E577E60C8087647A7CDEDD51539443A40F45982C7588D7C6AEF"},{"RelativePath":"experiment_set_manifest.json","Role":"experiment-set","Sha256":"1348B8E66E95F7771566D2B7E3AE15EC478A4AE5661507AAD93E57619B60BE2F"},{"RelativePath":"lineage/er06c-parent-owner-approval.json","Role":"parent-owner-approval-lineage","Sha256":"030084802951A973810DDE3F7E285DA9D6D09823E3CFB15719C45A2C3DC32396"},{"RelativePath":"model_config_v2.json","Role":"model","Sha256":"31207496214968CB471C7B690F6D9E1FF8F26B0E06A1C3EC11641CB5E91821A2"},{"RelativePath":"numerical_config_v2.json","Role":"numerical","Sha256":"2BC56A391FD42C962E7B60A9F3054EE241D619052C6A67C55CC37EAD11CE30A0"},{"RelativePath":"output_policy_v2.json","Role":"output-policy","Sha256":"806AA095A00651364CFD9F520591EE64A6EEE4720A0E697BA829AE4F108A329C"},{"RelativePath":"owner_approval_manifest.json","Role":"owner-approval","Sha256":"ACAA19AC748C66D171B06B46B44EDF1D394C54C1F5CA35ED366E23A41DB84D81"},{"RelativePath":"reliability_config_v2.json","Role":"reliability","Sha256":"E3DA18CA21A54DAA175D5A147CF2D5D46159119FE2D71C4C35379DEE659948F1"},{"RelativePath":"resource_ceiling_config.json","Role":"resources","Sha256":"65A61BF6DE20B569BD2295F44C6D1E0C6030D764CE46A60A40DA09FFA80B5E3E"},{"RelativePath":"retirement_denylist.json","Role":"retirement","Sha256":"85DBBE72A0C0311756968A632DD270305A7D3DB8166F067B2AF373010AF0EE98"},{"RelativePath":"rows/T6-ABL1.json","Role":"effective-experiment","Sha256":"BD8BBA2C53C0A8B5E6908CD8B95C218AFE10678CC932E6B23088309258AF1C5D"},{"RelativePath":"rows/T6-ABL2.json","Role":"effective-experiment","Sha256":"0B8A1D0CB4BF314B6F189E645C0985A528ABEC25432125F5C450CE66BB10AA53"},{"RelativePath":"rows/T6-ABL5.json","Role":"effective-experiment","Sha256":"6593DDB650727B6A3A00542ABE63BA643954AFD7328E6F518A617D1D0FB7D361"},{"RelativePath":"rows/T6-ABL6.json","Role":"effective-experiment","Sha256":"8DF836E487661F8B487B696CEC7A2CEFF8CAE4F9D438D06FA8A8687A12F60CED"},{"RelativePath":"rows/T6-ABL8.json","Role":"effective-experiment","Sha256":"851D5D2F5992863556FBD3A77DF5BCD8AEBBD01F8C258EE23411128C3002BBB9"},{"RelativePath":"rows/T6-S0-PRIMARY.json","Role":"effective-experiment","Sha256":"E6B249A30795F73BD889487FCEE10009BC7496E6FD78E30DF3808F48E88B091F"},{"RelativePath":"rows/T6-S1-SEV050.json","Role":"effective-experiment","Sha256":"3FAA87AD24E8D621D0317C8D9ED50F793CA306DFB291AE08B6FE88504E451782"},{"RelativePath":"rows/T6-S2-SEV075.json","Role":"effective-experiment","Sha256":"3D081F94C60F80D600E48A99BE5EBA3B94803551D4D9A7C0EEECB959EB588ECF"},{"RelativePath":"schemas/raw-schema-registry.csv","Role":"raw-schema-registry","Sha256":"7EFA07661F3FE2615B969156AFC4BCC387A4B898A1C7741A47464B930AB4F42C"},{"RelativePath":"split_manifest_v2.json","Role":"split","Sha256":"CD057C307FB6A3F59A6682339E3C48F8EA5566A2D30F1ADC89642FD575AA67A3"}],"OwnerId":"ER07B_R1_EXACT_HASH_RECOVERY","ProfileKind":"T6Scientific","SchemaVersion":"config-set-v2","ScientificUse":"MODEL_BASED_T6_SCIENTIFIC_EXECUTION_RUNTIME","UnresolvedPlaceholders":[]}